passages,questions
"3). as a result, a coherent network of middle lamellae is still intact despite intense decay by erosion bacteria [26]. this inability to degrade the middle lamellae or one might say incomplete decay, is the reason why archaeological wood still remain its form and integrity in wet condition",the inability to degrade the middle lamellae or incomplete decay is the reason why archaeological wood
"water fills out the degraded cell wall inside each fibre and the fragile middle lamellae provide enough physical strength to maintain the integrity of the wood. but if the wood is allowed to dry out, the capillary forces upon drying are so strong that the wood fibres will collapse and disintegrate","If the wood is allowed to dry out, will the capillary forces become stronger or weaker"
"but if the wood is allowed to dry out, the capillary forces upon drying are so strong that the wood fibres will collapse and disintegrate.erosion bacteria decay develops slowly from surface and inwards until all cellulose rich areas in the wood are utilised","if the wood is allowed to dry out, will the capillary forces on the wood become"
"erosion bacteria decay develops slowly from surface and inwards until all cellulose rich areas in the wood are utilised. in a viking pole, 1200 years old, this process was found to be still active in the interior parts [26]",How old was the viking pole when it was discovered that the process was still active in
"in a viking pole, 1200 years old, this process was found to be still active in the interior parts [26]. this allowed us to suggest that the process may go on for thousands of years. however, the rate of decay is not just dependent on time of burial",the rate of decay is not just dependent on what?
"this allowed us to suggest that the process may go on for thousands of years. however, the rate of decay is not just dependent on time of burial. in fact, it has been shown that environmental parameters and wood species may play a just as important role for progression of decay [4], [27], [28]",The rate of decay is not just dependent on what?
"in fact, it has been shown that environmental parameters and wood species may play a just as important role for progression of decay [4], [27], [28].the true identity of the erosion bacteria has been very difficult to clarify despite many efforts during the last twenty year",The true identity of the erosion bacteria has been difficult to clarify despite many efforts over how many
"the true identity of the erosion bacteria has been very difficult to clarify despite many efforts during the last twenty year. isolation and cultivation of single species with traditional methods has failed, which is the case for a majority of bacteria in nature",How long has it been difficult to clarify the true identity of the erosion bacteria?
"however, in a recent european commission funded research project, bacpoles, it was concluded, with help of dna technique, that erosion bacteria probably is a wide group different bacteria species, where some isolated species belongs to the group of flavobacteria and cytophaga [29]",How many different bacteria species are there?
"other dna analyses of waterlogged archaeological wood has showed that the wood host a wide spectre of many different bacteria species, but they are most likely secondary bacteria with other tasks than wood degradation [30]",dna analyses of waterlogged archaeological wood has shown that the wood host a wide spect
the interaction between bacterial and fungal species inside the wood in situ is most interesting and a matter for future research,the interaction between bacterial and fungal species inside the wood in situ is most interesting and a
soft rot fungi soft rot fungi degrade wood in both terrestrial and aquatic environments and are considered to have lower requirements for oxygen than basidiomycetes that are active above ground [1],Which type of fungi degrade wood?
"soft rot fungi belongs to the group of ascomycetes and fungi imperfecti and are named by the appearance of the wood after decay as the surface turns soft [31].aquatic soft rot fungi are common wood degraders in seawater and other natural water systems like lakes, rivers and ponds",Which group of ascomycetes and fungi imperfecti are named by the appearance
"aquatic soft rot fungi are common wood degraders in seawater and other natural water systems like lakes, rivers and ponds. more than 400 species are known from literature and novel species are frequently observed and described [32], [33]",How many species of soft rot fungi are known from literature?
"more than 400 species are known from literature and novel species are frequently observed and described [32], [33]. they degrade wood exposed in the water column at low and high depths and at varying waters temperatures [34]",How many species are known from literature and novel species?
"they degrade wood exposed in the water column at low and high depths and at varying waters temperatures [34]. some aquatic soft rot fungi are obligate marine which means that they only reproduce and grow in saline waters, whereas other species are obligate fresh water fungi",Which type of fungi are obligate marine?
"a large group of aquatic fungi have wide tolerance for both water temperatures and salinities, which means that they can be found in wide diverse environments [35]",A large group of aquatic fungi have a large tolerance for what two things?
"terrestrial soft rot fungi are most active in the upper soil layer where the soil is very wet/humid, or where periodic desiccation provides an environment with varying humidity's",Where are the soft rot fungi most active?
"they are therefore most active in the soil/air interface zone, from where a large number of species have been studied, isolated and identified [1]",where are the species most active?
"especially their attack on standing wooden poles has been carefully evaluated, as they are able to cause great harm at the base, which have let to deadly accidents in connection with inspection of telephone poles",what has the damage done to the poles?
the terrestrial soft rot decay patterns in wood are well known [36] and seem identical to the decay patterns observed in wood from aquatic environments [37],Which decay patterns are similar to the ones observed in aquatic environments?
"initial infestation takes place from the wood surface where hyphae penetrate the wood through the natural openings like rays and pits, including vessels of hardwoods [1]",Where does hyphae penetrate the wood?
"positioned inside the lumen, a local penetration of the massive wood cell wall takes place where the cellulose rich secondary cell wall is target for an advanced enzymatic decay process",where is the secondary cell wall located?
"fungal growth spreads to adjacent fibres by hyphal penetration, and in short time a smaller area of the wood is infected.soft rot cause two different types of attack, where type 1 is most common [38]",Which type of rot is most common?
"soft rot cause two different types of attack, where type 1 is most common [38]. glass disease, also referred to as sick glass or glass illness, is a degradation process of glass that can result in weeping, crizzling, spalling, cracking and fragmentation",How many types of glass disease are there?
"[1][2] glass disease is caused by an inherent instability in the chemical composition of the original glass formula.[3] properties of a particular glass will vary with the type and proportions of silica, alkali and alkaline earth in its composition",The composition of a glass will vary with the composition of what element?
"[3] properties of a particular glass will vary with the type and proportions of silica, alkali and alkaline earth in its composition.[4] once damage has occurred it is irreversible, but decay processes can be slowed by climate control to regulate surrounding temperature, humidity, and air flow","The composition of a glass will vary with the composition of silica, alkali, and"
glass disease is caused by an inherent fault in the chemical composition of the original glass formula,glass disease is caused by an inherent fault in the chemical composition of what?
"[3] glass contains three types of components: network formers establish basic structure, network stabilizers make glass strong and water resistant, and flux lowers the melting point at which the glass can be formed",How many types of component are there in glass?
"[5] common formulations of glass may include silica (sio2) as a former, alkali oxides such as soda (na2o) or potash (k2o) for flux, and alkaline earth oxides such as lime (cao) for stabilizing.[4][5]structurally, glass is composed of a network of sio4 tetrahedrons",Which is a former alkaline earth oxide?
"[4][5]structurally, glass is composed of a network of sio4 tetrahedrons. in addition to the network former silicon which establishes its principal structure, glass contains network modifying agents such as the alkali ions na+ and k+ and the alkali earth ions ca2+ and mg2+",Which two alkaline ions are present in glass?
"glass does not have a defined stoichiometry, rather the network is flexible. it can incorporate other ions, depending upon factors such as the main composition and firing conditions of the glass.[6] this causes almost all glass to be chemically unstable to some extent","Given all glass is chemically unstable, will it have a defined stoichiometry or a defined"
"[6] this causes almost all glass to be chemically unstable to some extent.[7]the likelihood of degradation due to glass disease depends on the amount and proportion of alkaline compounds mixed with silica, and on surrounding conditions",the likelihood of degradation due to glass disease depends on the amount of alkaline compounds mixed with
[3] inadequate calcium oxide causes the alkalis in the glass to remain water soluble at a low level of humidity. exposure to higher levels of relative humidity during storage or display causes alkali to hydrate and leach out of the glass. repeated changes in humidity can be particularly damaging,What causes alkali to leach out of a glass?
repeated changes in humidity can be particularly damaging. it is important to realize that any glass object can deteriorate if it is exposed to unsuitable environmental conditions,what can happen to glass if exposed to unsuitable conditions?
"it is important to realize that any glass object can deteriorate if it is exposed to unsuitable environmental conditions.[9] crystal, historic glass, or treasured family items should never be exposed to the high temperatures and water pressure of a dishwasher",What should never be exposed to the high temperatures of a dishwasher?
"[10][11]energy dispersive x ray analysis (edxa),[1][8] scanning electron microscopy (sem) and secondary ion mass spectrometry (sims) can be used to study exchange reactions in different types of glass",Sims are an example of what type of electron microscopy?
"by quantifying and studying chemical structure and reactions at the near surface layer, the mechanisms of glass disease can be better understood",How can the mechanisms of glass disease be understood?
"[7] measurement of the ph of glass surfaces is particularly important if glass objects have a matte surface, or have been exposed to kaolin or other substances","If glass surfaces have a matte surface or have been exposed to kaolin or other substances,"
"in the case of extremely small objects such as glass beads, ph measurement may be necessary to determine whether alkaline salts are present and changes in the glass are occurring",can ph measurement be used to determine if alkaline salts are present in glass beads?
[9][12]the processes involved in glass disease can reduce the transparency of the glass or even threaten the integrity of the structure,The processes involved in glass disease can reduce the integrity of the structure or even what?
"glass disease causes a complex disintegration of the glass which can be identified through a variety of symptoms, including weeping, crizzling, spalling, cracking and fragmentation.[3]the initial stage of glass disease occurs when moisture causes alkali to be leached out of the glass",the initial stage of glass disease occurs when moisture causes what to be leached out of the
[3]the initial stage of glass disease occurs when moisture causes alkali to be leached out of the glass. this becomes apparent when hygroscopic alkali deposits on the glass give it a cloudy or hazy appearance.[7][13] this may occur within as little as five to 10 years of the glass's manufacturing, alkali deposits on glass give it a cloudy or hazy appearance?
"[7][13] this may occur within as little as five to 10 years of the glass's manufacturing. the glass may feel slippery or slimy[10] and tiny droplets, or weeping, may be seen in high humidity (above 55%)",Is it possible for glass to feel slippery or slimy?
"the glass may feel slippery or slimy[10] and tiny droplets, or weeping, may be seen in high humidity (above 55%).[14] the hydrated alkali can form fine crystals on the surface of the glass in low relative humidity (below 40%)",At what temperature can tiny droplets of water be seen on the surface of a glass?
"[14] the hydrated alkali can form fine crystals on the surface of the glass in low relative humidity (below 40%).[4]at this stage, it may be possible to gently wash the glass and remove the surface alkali",At what temperature can alkaline crystals form on the surface of a glass?
"[4]at this stage, it may be possible to gently wash the glass and remove the surface alkali.[14] this will help to stabilize the glass by reducing the surface ph, and by removing dust, soiling, and hygroscopic components that attract further moisture","To stabilize the glass by reducing the surface ph, you can do what?"
"[9]if alkali builds up due to ion exchange, and remains on the surface of the glass, the decay process will accelerate. the presence of sodium or potassium ions in the alkali build up will increase the ph on the surface of the glass, causing it to become basic","if alkali builds up on the surface of the glass, will the decay process begin or"
"the presence of sodium or potassium ions in the alkali build up will increase the ph on the surface of the glass, causing it to become basic. this will dissolve silica from the glass as well as releasing more alkali ions",will the presence of sodium or potassium ions in the alkali build up or decrease the ph
"this will dissolve silica from the glass as well as releasing more alkali ions.[10][7]the haziness seen on the glass may not disappear entirely when washed and dried. when examined closely at an angle with a low light, fine cracks like tiny silvery lines or shimmering rays, may be visible",Is the haziness of the glass higher or lower when washed and dried?
"when examined closely at an angle with a low light, fine cracks like tiny silvery lines or shimmering rays, may be visible.[13] a microscope can confirm the presence of cracks. the cracks are caused by the loss of alkali, which leaves microscopic gaps in the structure of the glass",the cracks in glass are caused by the loss of what?
"the cracks are caused by the loss of alkali, which leaves microscopic gaps in the structure of the glass.[14]as higher amounts of alkali leach from the glass cracks are likely to become deeper. crizzling is a distinctive network of fine cracks in the glass which is visible to the naked eye",the cracks in the glass are caused by the loss of what?
"crizzling is a distinctive network of fine cracks in the glass which is visible to the naked eye.[3][15] in some cases, the crazing can gain a more uniform appearance.[13] however, crizzling may not be uniform due to the creation of micro climates on the glass",Crizzling is a distinctive network of fine cracks in what?
"[13] however, crizzling may not be uniform due to the creation of micro climates on the glass.[14]distinct cracks may appear on the surface of the glass, and surface material may flake or chip, a process referred to as spalling","Due to the creation of micro climates on the glass, what may not be uniform on the"
"[14]distinct cracks may appear on the surface of the glass, and surface material may flake or chip, a process referred to as spalling.[14][13]in the most severe stage of deterioration, the structural integrity of the glass has been lost and the glass may separate into pieces",What is it called when the surface material of a glass is damaged or split?
"[14][13]in the most severe stage of deterioration, the structural integrity of the glass has been lost and the glass may separate into pieces.in the earliest stage of glass disease, it may be possible to wash the glass to remove the surface alkali","in the earliest stage of glass disease, it may be possible to wash the glass to remove"
"in the earliest stage of glass disease, it may be possible to wash the glass to remove the surface alkali. the corning museum of glass recommends washing with tap water (tepid, not hot[18]) and a mild (non ionic[18]) conservation detergent",Is it possible to wash the glass to remove the surface alkali?
"the corning museum of glass recommends washing with tap water (tepid, not hot[18]) and a mild (non ionic[18]) conservation detergent. this should be followed by rinsing with de ionized or distilled water, and careful drying to remove moisture",how to wash corning museum of glass?
"this should be followed by rinsing with de ionized or distilled water, and careful drying to remove moisture. careful washing can remove surface deposits, restore the appearance of clearness to the glass, and help to slow further deterioration",remove surface deposits from glass
"careful washing can remove surface deposits, restore the appearance of clearness to the glass, and help to slow further deterioration.[19][18] ethanol has also been suggested for cleaning, particularly for glass beads, depending on the surrounding materials that may be affected",Which has been suggested for cleaning glass beads?
"[19][18] ethanol has also been suggested for cleaning, particularly for glass beads, depending on the surrounding materials that may be affected.[9]once more serious damage has occurred, it cannot be reversed. climate control of humidity and temperature is a possible intervention","If there is a serious damage to glass beads, what is an intervention?"
"[9]once more serious damage has occurred, it cannot be reversed. climate control of humidity and temperature is a possible intervention. because crizzling results from the reaction of components of the glass with water vapour, controlling humidity and temperature can slow its occurrence",Crizzling results from the reaction of components of the glass with water vapour and
"[3] at the corning museum of glass, items in the collection are kept at stable levels of relative humidity, between 40 and 55 percent.[10] fans may be used within a case to encourage the movement of air and minimize adsorption of moisture on the glass surface",What is the humidity of the corning museum of glass?
[10] fans may be used within a case to encourage the movement of air and minimize adsorption of moisture on the glass surface. deterioration is more likely to occur in areas with restricted air flow which allow moisture to remain on the glass,"To prevent moisture from remaining on the glass, fans are often used where?"
deterioration is more likely to occur in areas with restricted air flow which allow moisture to remain on the glass.[14] chemical methods for retarding corrosion rates and stabilizing surfaces are being investigated,Is corrosion rate higher or lower in areas with restricted air flow?
"[14] chemical methods for retarding corrosion rates and stabilizing surfaces are being investigated.[4]when a composite object contains a variety of materials, one of which is sick glass, the considerations involved in conserving and displaying the object become more complicated",What is being investigated when a composite object contains a variety of materials?
"for example, the british museum chose to conserve and display a siberian shamanic apron made of leather, glass and other materials",What kind of apron did the british museum conserve?
they weighed the likelihood that it would decay more quickly if shown against the desirability of making a unique object visible and the inevitability of its eventual degradation,"if a unique object was shown to decay quickly, would it likely decay faster or slower?"
"""its conservation and display ensures that access to this beautiful and unique object is maximized before the pale yellow beads, which are intrinsic to the object, are inevitably lost beyond repair",What ensures access to the beautiful and unique object is maximized before the pale yellow beads are
"""[1]our methods and field techniques have evolved over the last decade, but the principal aspects of wall conservation have remained the same",What has remained the same over the last decade?
the first stage of architectural stabilization was to remove as much as possible of the ancient earth mortar from between the wall stones on all exposed facets of the walls,the first stage of architectural stabilization was to remove as much as possible of the ancient earth mortar
"the purpose was to clean the interstices of the wall blocks to a depth of about 10 cm, or as deeply as possible into the wall face, without moving or destabilizing the original position or coursing of the stones (figs. 4 5)",To clean the interstices of wall blocks to a depth of how many cm?
"4 5). while we initially used small diameter iron rods, ice picks, and small hand picks, to dig out the ancient mortar by hand, we later employed air pressure pistol shaped hammers, powered by air compressors, and fitted with a narrow wedge or chisel shaped head (fig. 6)",How did we initially dig out the ancient mortar?
"6).once the ancient mortar was removed, the wall was washed carefully with a hose or sprayer, using the water pressure to clean the surfaces and interstices of the stones (fig. 7). washing the walls before application of the mortar was critical",how to clean walls before application of the mortar?
"7). washing the walls before application of the mortar was critical. the process cleans and reduces the temperature of the surfaces of the wall stones facilitating the adherence, setting, and long term stability of the compound",the process of washing the walls before application of the mortar was critical because it reduced the temperature
"the mortar material we used experimentally in 2003 consisted of a mixture of lime, white cement, tephra, and a combination of fine and coarse grain sand",the material we used to make the base for the base was what?
"after observing the condition of the mortar after a year, we noticed that the material adhered well to the masonry, but wider interstices were less stable and some cracks were evident. in 2004 we removed the lime and tephra from the mixture, using principally sand and white cement",How long did it take to remove the lime and tephra from the mixture?
"in 2004 we removed the lime and tephra from the mixture, using principally sand and white cement.the final stages of wall conservation are equally arduous: this is the application of the mortar, and then the scraping of the interstices (fig. 8)",when did we remove the lime and tephra from the mixture?
"8). when applied, the mortar compound must be compacted deeply into the spaces between wall stones, normally using one’s fingers at first, and then wooden pegs, hammers and mallets",How to compact a brick wall?
"at this stage the air compressor pistols were effective; fitted with custom fashioned hammer shaped spikes, they could be used to pound the mortar deeply in between the wall stones, with considerable precision (fig. 9)",were air compressor pistols effective?
"these final stages of the process were perhaps the most important, as the bond between the mortar and stone must create a clean and even seam, sealing the spaces between wall stones completely so that no rain or wind born soil and vegetation can penetrate the exposed surfaces to take root in the wall",what was the most important part of the final stage of the process?
"this stage was also time sensitive—the mortars had to be pressed and scraped before setting (fig. 10)—and involved hundreds of hours of scraping down the interstices, further pressing the mortar into place against the stone surfaces",How long did it take for the mortars to be pressed and scraped?
"10)—and involved hundreds of hours of scraping down the interstices, further pressing the mortar into place against the stone surfaces. more detailed work, requiring a team of architectural conservators, was necessary to repair fractures in the stepped bench of the monumental civic building (fig",How long did it take to drill down the interstices of the civic building?
"11). ancient fissures in the fine sideropetra blocks of the bench had begun to expand, after exposure to the elements in 2005 and 2006",What happened to the sideropetra blocks of the bench in 2005 and 2006?
"extreme temperature fluctuations at this elevation—especially alternating freezing and warming trends during the winter months—combined with normal seismic activity, caused or widened multiple fractures within the building, and elsewhere on the site",What is the cause of the fractures within the building?
"those mosaics on sites that escaped being detached and relaid in past decades have also reached a crisis situation in many countries, if there is anything left of them (figure 5)", mosaics on sites that escaped being detached and relaid in past decades have reached a crisis
