passages,questions
"these salts can cause unsightly efflorescence and salt crystallization damage. in addition, it seems that sodium hydroxide can react with the constituent of some stones, thereby accelerating stone deterioration [16]",What can sodium hydroxide do to some stones?
"silica can be precipitated by the reaction between sodium silicate, as well as potassium silicate, and acids such as hydrochloric acid and arsenic acid [16, 88, 89]. however, these reactions result in the formation of soluble salts such as sodium chloride and sodium arsenate",How many acids are precipitated by the reaction between sodium silicate and potassium silicate?
"however, these reactions result in the formation of soluble salts such as sodium chloride and sodium arsenate. if the sodium silicate arsenic acid mixture is used to consolidate limestone, crystalline calcium arsenate can be produced by a reaction between calcium carbonate and arsenic acid",what is formed when calcium carbonate reacts with arsenic acid?
"the crystalline calcium arsenate appears to damage limestone by anisotropic crystal growth [16].insoluble silicates have been precipitated in stone by alternate treatments of sodium silicate and a variety of salts such as calcium chloride [16, 85, 88, 91] and zinc carbonate [90]",Which salts precipitated in stone by anisotropic crystal growth?
"colloidal silicates are first produced which eventually become crystalline [16], while soluble salts are produced as by products. impervious surface layers are also produced which trap water beneath [92]",Which type of silicates are first produced?
"impervious surface layers are also produced which trap water beneath [92]. apparently, the silicates precipitate relatively rapidly so that they are deposited near the surfaces of the treated stones",What do the surface layers of the treated stones do?
"apparently, the silicates precipitate relatively rapidly so that they are deposited near the surfaces of the treated stones.even with all the problems associated with the use of alkali silicates, they are still occasionally being applied [5]",how do alkali silicates precipitate?
"even with all the problems associated with the use of alkali silicates, they are still occasionally being applied [5]. recently, the successful use of soluble silicates was reported [93]",How many problems are there with soluble silicates?
"recently, the successful use of soluble silicates was reported [93]. however, the overwhelming evidence clearly indicates that alkali silicates should not be used for stone consolidating purposes",What type of silicates should not be used for stone consolidating purposes?
"however, the overwhelming evidence clearly indicates that alkali silicates should not be used for stone consolidating purposes.silicofluorides both hydrofluosilicic acid and soluble silicofluorides have been used to preserve and consolidate stone",why should alkali silicates be used for stone consolidating purposes?
"hydrofluorosilic acid should not be used on limestone as it reacts vigorously with calcium carbonate to form crystalline calcium silicofluoride, carbonic acid, and carbonate salts [91]",Ishydrofluorosilic acid used on limestone?
"the reaction occurs upon contact of the acid with the limestone producing a shallow crust with little consolidating value. hydrofluorosilic acid reacts more slowly with siliceous based sandstones to form a cementitious material, but again only the surface is hardened",hydrofluorosilic acid reacts slowly with siliceous based sandstones to form what
"hydrofluorosilic acid reacts more slowly with siliceous based sandstones to form a cementitious material, but again only the surface is hardened. hydrofluorosilic acid has a tendency to discolor both limestones and sandstones, especially if they contain iron [16]",Hydrofluorosilic acid reacts faster with what type of sandstones?
"hydrofluorosilic acid has a tendency to discolor both limestones and sandstones, especially if they contain iron [16].many soluble types of silicofluorides, such as magnesium, zinc, and aluminum, have been applied to limestone",How many soluble types of silicofluorides have been applied to limestone?
"many soluble types of silicofluorides, such as magnesium, zinc, and aluminum, have been applied to limestone. resulting products are silica, insoluble fluoride salts and carbon dioxide, which are formed near the surface of the limestone",What are examples of soluble types of silicofluorides?
"resulting products are silica, insoluble fluoride salts and carbon dioxide, which are formed near the surface of the limestone. therefore, only the surface is hardened, which eventually exfoliates [52, 76, 94]",Which product is formed near the surface of the limestone?
"therefore, only the surface is hardened, which eventually exfoliates [52, 76, 94]. soluble silicofluorides also react with calcareous sandstones and again only a hardened surface is obtained",How many soluble silicofluorides react with calcareous sandstones?
"soluble silicofluorides also react with calcareous sandstones and again only a hardened surface is obtained. further, soluble salts are formed when both limestone and calcerous sandstone are treated with silicofluorides [60]", soluble salts are formed when both limestone and calcerous sandstones are treated with what?
"further, soluble salts are formed when both limestone and calcerous sandstone are treated with silicofluorides [60]. these soluble salts have caused damage through salt recrystallization processes [86]", soluble salts have caused damage through what process?
these soluble salts have caused damage through salt recrystallization processes [86]. penkala [95] recently carried out a systematic study of several stone treatments and also found that fluorosilicates were not effective consolidators,the soluble salts have caused damage through what process?
calcium hydroxide aqueous solutions of calcium hydroxide (its saturated solution is often called limewater) have been used for many centuries to protect and consolidate limestone [96],For how long have aqueous solutions of calcium hydroxide been used?
"calcium hydroxide itself does not appear to consolidate stone, but when in solution or a wet state it reacts with atmospheric carbon dioxide to form insoluble calcium carbonate, which may bind particles of calcareous stones together",calcium hydroxide reacts with atmospheric carbon dioxide to form what?
"the solubility of calcium hydroxide is only about 1 gram per liter at room temperature [97], therefore repeated applications are necessary to produce sufficient calcium carbonate to consolidate stone",What is the solubility of calcium hydroxide?
"furthermore, unless very dilute solutions are used, only the calcium hydroxide deposited near the surface of a stone is carbonated. this happens if the dense calcium carbonate being formed at the surface fills the pores and voids in the stone",where is calcium hydroxide deposited near the surface of a stone?
this happens if the dense calcium carbonate being formed at the surface fills the pores and voids in the stone. this severely impedes the migration of carbon dioxide through the treated surface to the interior of the stone,what is formed at the surface of a stone?
this severely impedes the migration of carbon dioxide through the treated surface to the interior of the stone.the newly produced calcium carbonate is susceptible to the same deterioration processes as the calcareous stone,the newly produced calcium carbonate is susceptible to the same deterioration processes as the calcareous
"the newly produced calcium carbonate is susceptible to the same deterioration processes as the calcareous stone. for example, it can react with sulfur trioxide to form calcium sulfate, which is relatively soluble compared to calcium carbonate",is calcium carbonate soluble or unstable?
"for example, it can react with sulfur trioxide to form calcium sulfate, which is relatively soluble compared to calcium carbonate. therefore, the treated stone may not be protected against further weathering",Is calcium carbonate soluble or soluble?
"therefore, the treated stone may not be protected against further weathering. however, the treated stone may eventually gain the authentic appearance of the weathering stone.conflicting opinions have been given of the effectiveness of the calcium hydroxide process",What can be protected against further weathering?
"some conservators [8, 16] have felt that while treatment with calcium hydroxide causes no harm, little permanent consolidation is obtained, while others [50, 96, 98, 99] have recommended the use of lime water to protect limestone from weathering and to consolidate them",How many conservators have recommended the use of lime water to protect limestone from weathering and
"the effectiveness of freshly prepared slaked lime (calcium oxide mixed with water) in consolidating statues at the wells cathedral in england is being investigated by professor baker [100]. he is applying 38 mm thick layers of slaked lime to statues, which are being removed several weeks later",Who is studying the effectiveness of freshly prepared slaked lime?
"he is applying 38 mm thick layers of slaked lime to statues, which are being removed several weeks later. some consolidation appears to be occurring",are the layers of slaked lime being removed?
"some consolidation appears to be occurring.apparently, repeated limewater and slaked lime treatment can gradually consolidate limestone, but such processes are only economically feasible for small objects",can limewater and slaked lime treatment slowly consolidate limestone?
"strontium and barium hydroxides similar to calcium hydroxide, strontium and barium hydroxides will react with carbon dioxide to form insoluble carbonates. again, only the hydroxide near surface of a stone is usually carbonated",Will strontium and barium hydroxides react with carbon dioxide to form insoluble
"again, only the hydroxide near surface of a stone is usually carbonated. however, unlike calcium sulfate, strontium and barium sulfates are insoluble and thus the application of strontium and barium hydroxides may reduce the weathering of stone exposed to polluted environments",Is the hydroxide near surface of a stone carbonated or carbonated?
"the early work on the use of barium hydroxide to conserve stone was performed by church [101 103]. initially, excellent results were obtained. however, only a surface hardening was being obtained and eventually the barium carbonate or barium sulfate layer exfoliated [16, 50, 76, 92]",Who performed the first work on the use of barium hydroxide to conserve stone?
"the exfoliation problem has been attributed not only to the formation of a dense impervious surface layer, but also to anisotropic crystal growth of barium carbonate and barium sulfate [16, 50]",the exfoliation problem has been attributed to the formation of a dense impervious surface layer
lewin [104] and sayre [105] have developed methods intended to precipitate barium carbonate and barium sulfate deeply within a stone. these methods are based on a process known as precipitation from homogeneous solution [106],the methods of precipitate barium carbonate and barium sulfate deeply within a stone
these methods are based on a process known as precipitation from homogeneous solution [106]. in this process the material to be precipitated and the precipitating chemicals are present in the same solution,p precipitation from homogeneous solution is based on a process called what?
"in this process the material to be precipitated and the precipitating chemicals are present in the same solution. for example, barium carbonate is precipitated from an aqueous solution of barium hydroxide and urea [104, 108]. the urea slowly undergoes hydrolysis producing ammonia and carbon dioxide",is barium carbonate precipitated from aqueous solution of urea and urea
the urea slowly undergoes hydrolysis producing ammonia and carbon dioxide. the liberated ammonia and carbon dioxide dissolves in the water forming ammonium carbonate which raises the ph of the solution,the urea slowly undergoes hydrolysis producing what?
"the liberated ammonia and carbon dioxide dissolves in the water forming ammonium carbonate which raises the ph of the solution. when a certain ph is reached, barium hydroxide reacts with the carbonate ion and barium carbonate is precipitated",is barium hydroxide precipitated or precipitated?
"when a certain ph is reached, barium hydroxide reacts with the carbonate ion and barium carbonate is precipitated. the reaction rate can be controlled so the barium carbonate precipitate forms days after a stone is treated",when is barium carbonate precipitated?
the reaction rate can be controlled so the barium carbonate precipitate forms days after a stone is treated. the slow formation of barium carbonate is reported to give a crystalline solid solution with the calcite crystals of calcareous stone,the reaction rate of barium carbonate is controlled when?
the slow formation of barium carbonate is reported to give a crystalline solid solution with the calcite crystals of calcareous stone. barium sulfate can be precipitated in a stone by an analogous method,can barium sulfate be precipitated in a stone?
"barium sulfate can be precipitated in a stone by an analogous method. an aqueous solution of a barium monoester of sulfuric acid hydrolyzes slowly when a base is added, releasing barium and sulfate ions [106]",how do you precipitate barium sulfate in a stone?
"an aqueous solution of a barium monoester of sulfuric acid hydrolyzes slowly when a base is added, releasing barium and sulfate ions [106].the precipitation of barium carbonate and barium sulfate by homogeneous solution precipitation methods is clearly a promising approach",the precipitation of barium carbonate and barium sulfate by homogeneous solution precipitation methods
"the precipitation of barium carbonate and barium sulfate by homogeneous solution precipitation methods is clearly a promising approach. to date, however, only experimental testing has been carried out and little is known concerning the long term consolidating effectiveness of this approach",What is a promising approach?
"warnes [16] and marsh [50] have both suggested that crystalline inorganic precipitates, such as barium carbonate and sulfate, do not have long term consolidating value",Which precipitates do not have long term consolidating value?
"also the precipitates of barium carbonate and barium sulfate have a larger molecular volume than calcite and appear to exhibit anisotropic crystal growth [16, 50]. it should not be assumed that deteriorated stone will have sufficient empty volume to accommodate these precipitates",Which precipitates have a larger molecular volume than calcite?
"therefore, until more is known of the long term effects of barium carbonate and barium sulfate on the durability of stone, they should be regarded as experimental materials which should not be applied to important historic structures",What should be regarded as experimental materials which should not be applied to important historic structures?
"alkoxysilanes are regarded by many stone conservators [8, 25, 59, 99, 109 114] as being among the most promising stone consolidating materials for siliceous sandstones. the feasibility of using alkoxysilanes to consolidate calcareous stone is also being studied [115 116]",How many more alkoxysilanes are there than stone conservators?
"the main reasons that alkoxysilanes are being highly regarded are their abilities to penetrate deeply into porous stone and the fact that their polymerization can be delayed until deep penetration has been achieved [25, 58, 99, 109, 110, 112]",How many alkoxysilanes are highly regarded?
"in addition, they polymerize to produce materials similar to the binder in siliceous sandstone.the use of alkoxysilanes for consolidating stone is not a recent development. for example, laurie [117] received a patent in 1925 for producing such a material to be used for stone consolidation",the use of alkoxysilanes for consolidating what is a recent development?
"for example, laurie [117] received a patent in 1925 for producing such a material to be used for stone consolidation. other early researchers on the use of alkoxysilanes to consolidate stone are cogan and setterstrom [118 119]. alkoxysilanes have been commonly used since around 1960 in germany [5]",How many researchers on the use of alkoxysilanes to consolidate stone are there?
"alkoxysilanes have been commonly used since around 1960 in germany [5]. recently, a promising alkoxysilane consolidating material was developed at the uk building research establishment, called ""brethane"" [112]",How many years have alkoxysilane consolidating material been used?
"recently, a promising alkoxysilane consolidating material was developed at the uk building research establishment, called ""brethane"" [112].price [58] and weber [111] have observed that alkoxysilanes can penetrate porous stones to a depth of between 20 to 25 mm",where was the promising alkoxysilane consolidating material developed?
price [58] and weber [111] have observed that alkoxysilanes can penetrate porous stones to a depth of between 20 to 25 mm. the newly developed brethane has been reported [112] to penetrate as deeply as 50 mm,Which two companies have observed that alkoxysilanes can penetrate porous stones to a depth
"the newly developed brethane has been reported [112] to penetrate as deeply as 50 mm. no noticeable polymerization occurs with brethane for at least 3 hours after it is mixed with a solvent and catalysis [58, 109]",How long does it take for the newly developed brethane to penetrate as deeply as 50
"no noticeable polymerization occurs with brethane for at least 3 hours after it is mixed with a solvent and catalysis [58, 109]. the large sizes of unpolymerized alkoxysilane molecules, no doubt, will prevent them from entering the smaller pores of a stone",how long does it take for the polymerization of brethane to occur?
"the large sizes of unpolymerized alkoxysilane molecules, no doubt, will prevent them from entering the smaller pores of a stone.marschner reported [120] that alkoxysilanes improved the resistance of sandstone to sodium sulfate crystallization",who reported that alkoxysilanes improved the resistance of sandstone to sodium sulfate
"marschner reported [120] that alkoxysilanes improved the resistance of sandstone to sodium sulfate crystallization. however, she also observed that their performance varied from sandstone to sandstone and also depended on the compatibility between the solvent and the specific stone being treated", alkoxysilanes improved the resistance of sandstone to what crystallization?
similar findings were reported by moncrieff [115] who studied the consolidation of marble,who studied the consolidation of marble?
snethlage and klemm [121] observed in a scanning electron microscope analysis of impregnated sandstone that a polymerized alkoxysilane appeared to fill the space between sandstone grains and form a continuous coating,a polymerized alkoxysilane appeared to fill the space between sandstone grains and
"however, polymerized alkoxysilanes are reported [25, 58,110, 115] to have little effect on moisture passage in stone and the frost resistance of stone. some slight changes in the color of treated stone have been observed [122, 123]",How many alkoxysilanes are reported to have little effect on moisture passage in stone
"some slight changes in the color of treated stone have been observed [122, 123]. for example, statutes on the wells cathedral have become more dull grey following treatment with an alkoxysilane [123]",Is the color of treated stone dull or dull?
"for example, statutes on the wells cathedral have become more dull grey following treatment with an alkoxysilane [123]. further, a treated stone panel on the cathedral has acquired a slightly more orange tone than adjacent untreated panels",Is the treated stone panel on the wells cathedral dull or orange?
"further, a treated stone panel on the cathedral has acquired a slightly more orange tone than adjacent untreated panels.once a section of stone is treated with alkoxysilane, it will probably weather differently than the untreated stone",can a treated stone panel be treated with alkoxysilane?
"once a section of stone is treated with alkoxysilane, it will probably weather differently than the untreated stone. thus, unless most of the visible parts of a structure are similarly treated, the contrast between the treated and untreated stone could become very noticeable","If a stone is treated with alkoxysilane, will it probably weather differently or"
"strength improvements of around 20 percent have been reported [25, 110] when sandstone specimens were impregnated with alkoxysilanes. the ability of alkoxysilanes to consolidate deteriorated stone in the field, however, has not been unequivocally demonstrated",How many percent of strength improvements have been reported when sandstone specimens were impregnated with
"the ability of alkoxysilanes to consolidate deteriorated stone in the field, however, has not been unequivocally demonstrated. further, it appears that the performance of alkoxysilanes varies from stone to stone",The ability of alkoxysilanes to consolidate deteriorated stone in the field has not been
"further, it appears that the performance of alkoxysilanes varies from stone to stone.even if alkoxysilanes are found to be effective consolidants, their high cost [28, 112] will probably limit their use to statues and smaller sized stone objects",what is a drawback of alkoxysilanes?
"synthetic organic polymer systems two general types of synthetic organic polymer systems are used to consolidate stone. in the first, monomeric organic molecules are first polymerized, dissolved in appropriate solvents, and then applied to stone",How many general types of synthetic organic polymer systems are there?
"in the first, monomeric organic molecules are first polymerized, dissolved in appropriate solvents, and then applied to stone. they are deposited within the voids and pores of the stone as the solvent evaporates","when are monomeric organic molecules first polymerized, dissolved in appropriate solvents,"
"they are deposited within the voids and pores of the stone as the solvent evaporates. the second type are monomeric organic molecules, either pure or dissolved in a solvent, which are polymerized within the voids and pores of a stone",How are monomeric organic molecules deposited?
"the second type are monomeric organic molecules, either pure or dissolved in a solvent, which are polymerized within the voids and pores of a stone. viscous monomers are diluted with solvents so that deep penetration can be achieved [57]",How are monomeric organic molecules polymerized?
"solvents which evaporate rapidly (most common organic solvents), however, have been found to draw organic consolidants back to the surface of a stone, resulting in the formation of impervious hard surface crusts [57, 61]",What are the most common organic solvents?
munnikendam [59] has recommended that organic consolidants should be selected whose solidification does not depend on solvent evaporation.both thermoplastics and thermosets have been used to consolidate stone,What has been used to consolidate stone?
both thermoplastics and thermosets have been used to consolidate stone. a thermoplastic is a material which can be reformed by the application of heat without significant changes in properties,is a thermoplastic the same as a thermoset?
"a thermoplastic is a material which can be reformed by the application of heat without significant changes in properties. examples of thermoplastics are poly(vinylchloride), poly(ethylene), nylon, poly(styrene) and poly(methylmethacrylate)",What is a thermoplastic?
"examples of thermoplastics are poly(vinylchloride), poly(ethylene), nylon, poly(styrene) and poly(methylmethacrylate). a thermoset is a material which is formed into a permanent shape by the application of heat, and once formed, cannot be remelted or reformed",What are some examples of thermoplastics?
"a thermoset is a material which is formed into a permanent shape by the application of heat, and once formed, cannot be remelted or reformed. polyester, epoxy, and polyurethane are examples of thermosets",Is polyurethane an example of a thermoset?
"polyester, epoxy, and polyurethane are examples of thermosets. methylmethacrylate can be converted into a thermoset by copolymerization with a three dimensional cross linking material",How can methylmethacrylate be converted into a thermoset?
"methylmethacrylate can be converted into a thermoset by copolymerization with a three dimensional cross linking material.the use of synthetic organic polymer systems to consolidate stone is a recent development, dating back to around the early 1960's",the use of synthetic organic polymer systems to consolidate stone dates back to when?
"the use of synthetic organic polymer systems to consolidate stone is a recent development, dating back to around the early 1960's. therefore, little is known regarding the long term performance of these materials",What is a recent development?
"therefore, little is known regarding the long term performance of these materials. some organic consolidants have been found to improve significantly the mechanical properties of deteriorated stone",What has been found to improve the mechanical properties of deteriorated stone?
"some organic consolidants have been found to improve significantly the mechanical properties of deteriorated stone. many organic polymers are susceptible to degradation by oxygen and ultraviolet radiation, but this would only affect the materials on the surface of a treated stone [1]",What has been found to improve the mechanical properties of deteriorated stone?
