passages,questions
"consolidation initially, the surface that has undergone intergranular corrosion or intense weathering is consolidated to slow the phenomenon.old plaster removal after consolidation, older mortars that have failed or have caused cracks and other side effects are removed by mechanical means",How is old plaster removed after consolidation?
"old plaster removal after consolidation, older mortars that have failed or have caused cracks and other side effects are removed by mechanical means. the plaster is not removed in parts of the surface, where they can cause further damage to marble",Are older mortars removed or removed by mechanical means?
"the plaster is not removed in parts of the surface, where they can cause further damage to marble.nail removal the corroded iron or bronze pins that were placed to withhold broken fragments during earlier conservation interventions are removed and replaced, where necessary, with titanium",does the plaster have to be removed?
the pin removal system has been developed by the marble technicians.rust removal removing rust stains from corroded connectors is achieved by a neutralized thioglycolic acid solution,who developed the pin removal system?
"rust removal removing rust stains from corroded connectors is achieved by a neutralized thioglycolic acid solution.crack cleaning cleaning of cracks, gaps and internal fracture surfaces aims at the removal of loose fragments, particles and microorganisms",how to remove rust stains from corroded connectors?
"dismantling and joining stone fragments for fragments that are collapsing or remain deformed on the surface, the possibility of detachment is examined on a case by case basis and according to position",dismantling and joining stone fragments for fragments that are collapsing or deformed on the
basic criteria are the preservation of the material and the non alteration of the geometry of the surface during reassambly. where greater support is required (for larger fragments) invisible titanium pins are selectively placed. their sizing is calculated by a designated civil engineer,Who determines the sizing of the titanium pins?
their sizing is calculated by a designated civil engineer. for smaller fragments a mechanically weaker cement with the addition of lime mortar is used,who is responsible for sizing cement fragments?
"inlay of hinges the sealing of the joints is the final phase of the conservation works aiming  to prevent the entry of solid particles, ensure the runoff of rainwater and provide an aesthetic finish to the intervention",What is the final phase of the conservation works?
"protection in order to protect the sculptures, they are transferred to the acropolis museum",Where are the acropolis museum's sculptures kept?
the surfaces of the monuments that remain exposed to air pollution have to be coated by a protective material that will inhibit the sulphation process and protect the surface as well as the conservation intervention materials meeting the requirements for reversibility and compatibility with the original marble,the surfaces of monuments that remain exposed to air pollution have to be coated by what?
"after a long research project, conducted in the laboratory of material science and engineering by prof. t. skoulikidis, a material based on n semiconductors was advanced. these are metal oxides that acquire semiconducting properties when prepared electrolytically",who conducted the research project?
"these are metal oxides that acquire semiconducting properties when prepared electrolytically. their action is based on the inhibition of sulphation. among many such oxides tested, the aluminum oxide with a reversible polymer body proved to be the most effective",the action of aluminum oxide is based on the inhibition of what?
"the composition of the material is a methyl methacrylate body in toluene 10% with the addition of electrolytically prepared aluminum oxide (al2o3), which is the component with the properties of n semiconductor",what is the name of the component with the properties of n semiconductor?
"the n semiconductor, beyond the protection of the marble, protects the body from uv radiation and aging. this material has been applied on a column of the propylaea and an inscription on the plateau of the acropolis",where has the n semiconductor been applied?
"this material has been applied on a column of the propylaea and an inscription on the plateau of the acropolis.artificial patina to reduce the color contrast of the new marble complements, an artificial patina can be applied on selected occasions",What is the purpose of artificial patina?
"artificial patina to reduce the color contrast of the new marble complements, an artificial patina can be applied on selected occasions. the material consists of methyl methacrylate body with 10% in toluene, prepared electrolytically by adding iron oxide and mineral pigments",How can artificial patina be applied to marble?
"marble is a metamorphic rock consisting of carbonate minerals that recrystallize under the influence of heat, pressure and aqueous solutions, most commonly calcite (caco3) or dolomite (camg(co3)2) and has a crystalline texture of varying thickness",is camg(co3)2 the same as dolomite?
"marble is typically not foliated (layered), although there are exceptions.in geology, the term marble refers to metamorphosed limestone, but its use in stonemasonry more broadly encompasses unmetamorphosed limestone. marble is commonly used for sculpture and as a building material",is marble the same as metamorphosed limestone?
"marble is commonly used for sculpture and as a building material.marble is a rock resulting from metamorphism of sedimentary carbonate rocks, most commonly limestone or dolomite (rock). metamorphism causes variable recrystallization of the original carbonate mineral grains",is marble the same as dolomite?
metamorphism causes variable recrystallization of the original carbonate mineral grains. the resulting marble rock is typically composed of an interlocking mosaic of carbonate crystals,What causes variable recrystallization of carbonate mineral grains?
the resulting marble rock is typically composed of an interlocking mosaic of carbonate crystals. primary sedimentary textures and structures of the original carbonate rock (protolith) have typically been modified or destroyed,the original carbonate rock is typically composed of what?
primary sedimentary textures and structures of the original carbonate rock (protolith) have typically been modified or destroyed.pure white marble is the result of metamorphism of a very pure (silicate poor) limestone or dolomite protolith,is pure white marble the same as dolomite protolith?
"the characteristic swirls and veins of many colored marble varieties are usually due to various mineral impurities such as clay, silt, sand, iron oxides, or chert which were originally present as grains or layers in the limestone",what are some of the minerals that are present in the marble?
green coloration is often due to serpentine resulting from originally magnesium rich limestone or dolomite with silica impurities. these various impurities have been mobilized and recrystallized by the intense pressure and heat of the metamorphism,What is the cause of the green coloration?
"degradation by acids acids react with the calcium carbonate in marble, producing carbonic acid (which decomposes quickly to co2 and h2o) and other soluble salts : caco3(s) + 2h+(aq) → ca2+(aq) + co2(g) + h2o (l)outdoor marble statues, gravestones, or other marble structures are damaged by acid rain whether by carbonation, sulfation or the formation of ""black crust"" (accumulation of calcium sulphate, nitrates and carbon particles)",what causes marble to be damaged by acid rain?
[10] vinegar and other acidic solutions should be avoided in the cleaning of marble products.crystallization crystallization refers to a method of imparting a glossy more durable finish on to a marble floor (caco3),What should be avoided in the cleaning of marble products?
crystallization crystallization refers to a method of imparting a glossy more durable finish on to a marble floor (caco3). it involves polishing the surface with an acidic solution and a steel wool pad on a flooring machine,crystallization crystallization involves polishing the surface with an acidic solution and a steel wool
it involves polishing the surface with an acidic solution and a steel wool pad on a flooring machine. the chemical reaction below shows a typical process using magnesium fluorosilicate (mgsif6) and hydrochloric acid (hcl) taking place,the chemical reaction below shows a typical process using what two elements?
the chemical reaction below shows a typical process using magnesium fluorosilicate (mgsif6) and hydrochloric acid (hcl) taking place.caco3(s) + mgsif6(l) + 2hcl (l) → mgcl2(s) + casif6(s) + co2(g) + h2o(l)the resulting calcium hexafluorosilicate (casif6) is bonded to the surface of the marble,calcium hexafluorosilicate is bonded to the surface of what?
"this is harder, more glossy and stain resistant compared to the original surface.the other often used method of finishing marble is the use of polishing with oxalic acid (h2c2o4), an organic acid. the resulting reaction is as follows",what is an organic acid used to finish marble?
the resulting reaction is as follows.caco3(s) + h2c2o4(l) → cac2o4(s) + co2(g) + h2o(l) in this case the calcium oxalate (cac2o4) formed in the reaction is washed away with the slurry leaving a surface that has not been chemically changed,what is formed in the reaction of calcium oxalate (cac2o4)
microbial degradation the haloalkaliphilic methylotrophic bacterium methylophaga murata was isolated from deteriorating marble in the kremlin,microbial degradation the haloalkaliphilic methylotrophic bacterium methylophaga
"bacterial and fungal degradation was detected in four samples of marble from milan cathedral; black cladosporium attacked dried acrylic resin[13] using melanin. marble is a rock composed of calcium and magnesium carbonate, mostly white and pink",What was detected in four samples of marble from milan cathedral?
"marble is a rock composed of calcium and magnesium carbonate, mostly white and pink.[1] common marble varieties are granular limestone or dolomite",is calcium carbonate the same as magnesium carbonate?
"the hardness of marble is very high, because the internal structure of the rock is very uniform after long term natural aging, and the internal stress disappears, so the marble will not be deformed due to temperature, and has strong wear resistance. it is a very popular building material",Is the hardness of marble high or low?
it is a very popular building material.the perfection of ancient building technique assured the strong resistance of the monuments to natural forces for a long time,the perfection of ancient building technique assured the strong resistance of monuments to what?
"the perfection of ancient building technique assured the strong resistance of the monuments to natural forces for a long time. yet, in many cases, human activity upset the balance of the ancient construction, leaving the monument more susceptible to damage by the forces of nature",the perfection of ancient building technique assured the strong resistance of monuments to what?
"it is notable, however, that most of the damage that we are obliged to confront today does not originate in the action of the elements but in the interference of man. moreover, the damage caused by rescue or restoration interventions of the recent past is extensive",Most of the damage we are obliged to confront today does not originate in the action of what
"moreover, the damage caused by rescue or restoration interventions of the recent past is extensive. the failure of these interventions lies mainly in the use of ordinary iron for joining fragments of architectural members or for increasing the durability of others",what is an example of a failure of rescue or restoration?
"most of the damage suffered by the monuments and now being confronted in the framework of the contemporary interventions falls into the following categories:mechanical this includes damage wrought by earthquakes, explosions, bombardments, fires, freezing, and by the swelling of rusting iron reinforcements used in the interventions of the recent past",Most of the damage suffered by the monuments is classified as what?
"chemical this comprises forms of erosion suffered by the marble mainly as a result of acid rain. a serious problem connected with atmospheric pollution concerns the various accretions and deposits in the form of powder, carbon (black soot) and metal rust",What is the main cause of the erosion of marble?
"biological these are forms of corrosion caused by lichens, moulds, bird droppings, plant roots and their discharges.a general principle of the works is to carry them out on the basis of decisions taken as objectively as possible, with transparency in all phases",what is the general principle of the works?
"these goals are achieved primarily by means of an interdisciplinary approach to the interventions during the phases of study and application, the publication of general and specialized studies for the restoration of the monuments prior to the actual interventions, their submission as top level studies to a procedure of multiple assessment and then the final publication of the works",How are the goals achieved?
"the international conferences of specialists held at regular intervals for exchange of opinion about the various proposals for interventions on the monuments and other special subjects, comprise a particularly important feature of the works",the international conferences of specialists held at regular intervals for exchange of opinion about the various proposals for
"the interventions, in themselves, are conducted in the spirit of the venice charter (1964), the internationally accepted framework of principles codifying the requirements for the restoration of monuments",What is the venice charter?
"the following principles were formulated particularly for the monuments of ancient greek architecture, and stem from the actual building system of the monuments of the classical period.the principle of reversibility of the interventions",the principle of reversibility of the intervention in greek architecture is the principle of what?
"the principle of reversibility of the interventions. this means the possibility of returning the monument to its condition prior to the intervention.respect for the authentic material, retention of the structural autonomy of the architectural members and their original structural function",the principle of reversibility of the intervention is called what?
"compliance with the above theoretical principles leads to specific choices in planning structural interventions on the acropolis monuments, which can be summarized as follows:interventions are restricted to those parts of the monuments that have been damaged in earlier restorations or show structural deficiencies",What leads to specific choices in planning structural interventions on acropolis monuments?
the materials used in restoration must be harmless and compatible with the authentic materials,the materials used in restoration must be what?
"for joining fragments, the titanium rods required by the structural study, should be used as sparingly as possible and the holes for titanium reinforcements be as few as possible, so as to avoid damaging the ancient material",How to prevent damaging the ancient material?
"to the extent possible, the existing ancient cuttings are used for joining the members. the basic criterion for calculating the reinforcements is that in a near limit situation the reinforcements should fail rather than the ancient material",in a near limit situation the reinforcements should fail rather than what?
"in the joining of ancient fragments, only pieces that come from the same architectural member are joined together.in restoration supplements of new marble are limited","in addition to the joining of ancient fragments, only pieces that come from the same architectural member"
in restoration supplements of new marble are limited. the decision is always made on the basis of the structural and aesthetic autonomy of the member involved and the integrity of the area being restoredwhite marble has been prized for its use in sculptures since classical times,can you use white marble in sculptures?
"this preference has to do with its softness, which made it easier to carve, relative isotropy and homogeneity, and a relative resistance to shattering. also, the low index of refraction of calcite allows light to penetrate 12",the high index of refraction of what allows light to penetrate 12?
"7 to 38 millimeters into the stone before being scattered out, resulting in the characteristic waxy look which brings a lifelike luster to marble sculptures of any kind, which is why many sculptors preferred and still prefer marble for sculpting",How many millimeters is the difference between the mass of the marble and the waxy look
"construction marble is a stone which is composed of calcite, dolomite or serpentine that is capable of taking a polish",can you polish a marble?
"more generally in construction, specifically the dimension stone trade, the term marble is used for any crystalline calcitic rock (and some non calcitic rocks) useful as building stone",can you use the term marble for any crystalline rock?
"for example, tennessee marble is really a dense granular fossiliferous gray to pink to maroon ordovician limestone, that geologists call the holston formation.cleaning and prevention the nature of marble is soft and porous, so it is easily stained by colored liquids and scratches easily",Is tennessee marble soft or porous?
"cleaning and prevention the nature of marble is soft and porous, so it is easily stained by colored liquids and scratches easily. so daily maintenance and cleaning is particularly important.prevention prevent sand and dust from contacting the marble surface",how to prevent sand from contacting the marble surface
"so daily maintenance and cleaning is particularly important.prevention prevent sand and dust from contacting the marble surface. avoid corroding marble surfaces with alcohol, color and acidic liquids.cleaning as a floor material, marble is the easiest to scratch",how to clean a marble floor?
"avoid corroding marble surfaces with alcohol, color and acidic liquids.cleaning as a floor material, marble is the easiest to scratch. you can first use a vacuum cleaner to suck away the grit and dust on the marble floor, and then use a steam cleaner to remove other dirt",how to clean a marble floor
"you can first use a vacuum cleaner to suck away the grit and dust on the marble floor, and then use a steam cleaner to remove other dirt.a mild, ph neutral, non abrasive soap should be used for cleaning marble surfaces. wipe with a soft foam cotton or rag",how to clean marble floors
"a mild, ph neutral, non abrasive soap should be used for cleaning marble surfaces. wipe with a soft foam cotton or rag.salt crystallization crystallization of salts within the pores of stones can generate sufficient stresses to cause the cracking of stone, often into powder fragments",how to clean marble surfaces?
this process is considered to be the major cause of stone deterioration in many parts of western europe [24 26]. closely related to the crystallization of salt is damage caused by salt hydration and by differential thermal expansion of salts [14],the crystallization of salt is caused by salt hydration and by differential thermal expansion of salts
closely related to the crystallization of salt is damage caused by salt hydration and by differential thermal expansion of salts [14]. the resistance of stone to salt damage is dependent on the pore size distribution and decreases as the proportion of fine pores increases [11],the resistance of stone to salt damage is dependent on what?
"crystallization damage caused by highly soluble salts, such as sodium chloride and sodium sulfate, is usually manifested by powdering and crumbling of the stone's surface [11]. less soluble salts such as calcium sulfate form glassy, adherent films which cause spalling of a stone's surface [16]","Which is a less soluble salts, calcium sulfate or sodium chloride?"
"less soluble salts such as calcium sulfate form glassy, adherent films which cause spalling of a stone's surface [16].a major source of salts in urban environments is the reaction between air pollutants and stone",the reaction between air pollutants and stone is called what?
"a major source of salts in urban environments is the reaction between air pollutants and stone. for example, limestone can react with sulfur dioxide to ultimately produce calcium sulfate",What is a major source of salts in urban environments?
"for example, limestone can react with sulfur dioxide to ultimately produce calcium sulfate. other sources of salts include ground water [27], airborne salts [27], sea spray [28], chemical cleaners [29], and deicing salts [30].aqueous dissolution carbonate sedimentary stones e.g","Which is a source of calcium sulfate, ground water or sea spray?"
"aqueous dissolution carbonate sedimentary stones e.g., limestone and dolostone), carbonate cemented sandstone, and marbles are types of stone that are susceptible to dissolution by water acidified with dissolved carbon dioxide, sulfur dioxide, and nitrogen oxides [31]",is carbonate cemented sandstone a sedimentary stone or a metamorphic stone?
"it has been reported [32, 51] that the rainwaters in many urban areas in the united states and europe are sufficiently acidic to accelerate the weathering of exposed building stone",What is sufficiently acidic to accelerate the weathering of exposed building stone?
"in areas where the rainwater is relatively free from pollutants, the dissolution of most common building stones is usually not a serious problem [30].frost damage certain stones which are exposed to freezing temperatures and wet conditions may undergo frost damage",Is the dissolution of most common building stones a serious problem or minor problem?
"frost damage certain stones which are exposed to freezing temperatures and wet conditions may undergo frost damage. the frost susceptibility of a stone is largely controlled by its porosity and pore size distribution [33,34]",What is the pore size distribution of a stone?
"the frost susceptibility of a stone is largely controlled by its porosity and pore size distribution [33,34]. of stones with a given porosity, those with the smallest mean pore size will generally be the most susceptible to frost damage",Which stones are most susceptible to frost damage?
"of stones with a given porosity, those with the smallest mean pore size will generally be the most susceptible to frost damage. frost resistance also generally decreases with increased available porosity [15], i.e., pore volume which is accessible to water",Will pore volume increase or decrease with increased available porosity?
"frost resistance also generally decreases with increased available porosity [15], i.e., pore volume which is accessible to water. the frost resistance of a stone is often assessed from its saturation coefficient,(2) with stones having saturation coefficients less than 0",What is the saturation coefficient of a stone?
"the frost resistance of a stone is often assessed from its saturation coefficient,(2) with stones having saturation coefficients less than 0.8 being generally immune to frost damage [35]",What is the saturation coefficient of a stone?
"8 being generally immune to frost damage [35].some european stone conservators [11,26] believe that in their countries frost damage is not an important process in the deterioration of stone. they regard frost damage as a secondary process, e.g",Some european stone conservators regard frost damage as what?
"they regard frost damage as a secondary process, e.g., frost damage may be responsible for the final fragmentation of stone damaged by other processes, such as salt crystallization",is salt crystallization a secondary or secondary process?
"however, because of the use of possibly more frost susceptible stone and more severe climates, frost damage may be an important factor in the northern part of the united states [36,37]",What is an important factor in the northern part of the united states?
"microbiological growth the attack of stone by a variety of plants and animals has been reported [14] including roots of plants, ivy vines, microorganisms, boring animals, and birds. of these, microorganisms appear to be the most destructive",Which microorganism is the most destructive?
"of these, microorganisms appear to be the most destructive. some types of bacteria, fungi, algae, and lichens produce acids and other chemicals which can attack carbonate and silicate minerals [14, 38]",Which type of microorganism is most destructive?
"some types of bacteria, fungi, algae, and lichens produce acids and other chemicals which can attack carbonate and silicate minerals [14, 38]. it appears that under certain environmental conditions attack by microorganisms can be a serious problem [39 41]","How many types of bacteria, fungi, algae, and lichens are there?"
"however, it seems that many conservators feel that such instances are uncommon and that microorganism growth usually takes place in stone which had been partially deteriorated by other processes",What type of growth usually takes place in stone?
"human contact because of an increasing interest by the public in historic structures, the effects of human contact upon the condition of stone, as well as all other building materials, is of growing concern",Why is human contact an issue in historic structures?
